{
  "$schema": "https://json-schema.org/draft/2020-12/schema",
  "$id": "https://rpg-bot.example/contracts/jsonschema/media_job_response.schema.json",
  "title": "MediaJobResponse",
  "type": "object",
  "required": [
    "jobId",
    "jobType",
    "status",
    "createdAt",
    "updatedAt"
  ],
  "properties": {
    "jobId": {
      "type": "string",
      "minLength": 1
    },
    "jobType": {
      "type": "string",
      "enum": ["tts", "stt", "image", "avatar"]
    },
    "status": {
      "type": "string",
      "enum": ["queued", "processing", "succeeded", "failed"]
    },
    "result": {
      "type": ["object", "null" ]
    },
    "error": {
      "type": ["string", "null" ]
    },
    "createdAt": {
      "type": "string",
      "format": "date-time"
    },
    "updatedAt": {
      "type": "string",
      "format": "date-time"
    },
    "clientToken": {
      "type": ["string", "null" ]
    }
  },
  "additionalProperties": false
}
